"Identificação do post","Identificação da conta","Nome de usuário da conta","Nome da conta",Descrição,"Duração (s)","Horário de publicação","Link permanente","Tipo de post","Comentário de dados",Data,Visualizações,Alcance,Curtidas,Compartilhamentos,Seguimentos,Comentários,Salvamentos
18560486014036136,17841476283103388,setup.english,"SetUp - English School","Todo começo de ano traz aquela sensação de “AGORA VAI”, certo? A ideia é sempre que desta vez o inglês vai sair do papel, mas aprender algo não necessariamente segue o calendário.

Sendo sinceros, o inglês não é uma meta rápida de cumprir e com consistência ele cresce aos poucos e abre caminhos mesmo quando a rotina aperta. 

Quando o inglês vira só uma promessa de ano novo, costuma parar na primeira semana cheia. Quando vira parte da vida e da rotina, o processo continua e constrói grandes avanços. 

A pergunta não é se você vai estudar inglês este ano. É se you’re ready to treat it as something real.

Se isso faz sentido pra você, chama a gente na DM.",0,"01/14/2026 13:00",https://www.instagram.com/p/DTgWHczjCM2/,"Imagem do Instagram",,Total,1345,746,55,2,1,0,0
18091198037478914,17841476283103388,setup.english,"SetUp - English School","Chegou o Expressions of the Month, o resumo mensal das expressões que apareceram nos stories ao longo da semana.

Em dezembro, vimos:

> FRESH START = novo começo.

> ON STEROIDS = algo exagerado ou intensificado.

> TGIF (Thank God It’s Friday) = o famoso sextou!

> JUST AROUND THE CORNER = quando algo está prestes a acontecer.

Essas expressions apareceram ao longo das semanas nos stories e agora ficam reunidas aqui. Todo mês, um novo resumo com as expressões que você viu sendo usadas em situações reais.

Quer aprender inglês de forma leve, com foco no seu objetivo?

Send us a DM!",0,"01/10/2026 08:14",https://www.instagram.com/p/DTViRCbDjQF/,"Carrossel do Instagram",,Total,1550,446,24,8,0,0,1
18163005886366161,17841476283103388,setup.english,"SetUp - English School","Apenas sorria e acene.

Existe um abismo meio cruel entre o que você entende e o que você consegue falar? Na sua cabeça, a resposta vem linda, estruturada, quase um TED Talk (hahaha), mas quando fala, sai um clássico “The book is on the table”.

Isso não é falta de treino. Seu ouvido já corre uma maratona faz tempo mas sua língua ainda está aquecendo. Enquanto tudo se alinha, um “Yeah, totally” dito com confiança já salva muita conversa.

Esta é um fase da aprendizagem chamada plateau intermediário e é muito comum, fica tranquilo que com bastante treino, ela passa.",0,"01/29/2026 07:00",https://www.instagram.com/p/DUGU2i8CPTd/,"Imagem do Instagram",,Total,256,114,11,3,0,0,0
17960705253032142,17841476283103388,setup.english,"SetUp - English School","A curiosidade dessa palavra é que 80% dela é muda, sabia?

Você diz apenas o som da letra Q (/kjuː/), exatamente como a pronúncia dela no alfabeto em inglês. O resto (ueue) não tem som nenhum.

Ela uma palavra essencial para vocabulário de viagem e dia a dia. Concordam? Você vai ouvir muito frases como “Jump the queue” (furar fila) ou “Join the queue” (entrar na fila).

Parece uma palavra estranha e longa, mas a pronúncia é literalmente apenas o som de uma única letra.

Achou essa dica interessante? Continue acompanhando a gente por aqui!",0,"01/27/2026 07:00",https://www.instagram.com/p/DUBLRobCDkh/,"Imagem do Instagram",,Total,673,315,24,1,1,5,1
17907520059334947,17841476283103388,setup.english,"SetUp - English School","Muita gente trava no inglês não por falta de vocabulário, mas por traduzir tudo ao pé da letra. Um exemplo clássico: “Tenho 30 anos.”

Muita gente diz ""I have 30 years old!"", porque “have” significa ter e falamos assim em português. Em inglês, para falar de idade, usamos o verbo to be: ""I am 30 years old.""

Percebe como o erro não está em saber ou não o significado das palavras em inglês?

O problema é pensar em português enquanto fala inglês. A sua fluência começa a avançar quando você abandona o hábito de traduzir palavra por palavra e passa a entender a lógica da língua.

Traduzir literalmente pode, na verdade, te travar.",0,"01/25/2026 06:45",https://www.instagram.com/p/DT7_8WPDHLZ/,"Imagem do Instagram",,Total,370,150,18,0,0,2,0
18052055480442370,17841476283103388,setup.english,"SetUp - English School","Por isso, aqui na Set Up a gente acredita que seu inglês começa aqui e te leva para qualquer lugar.",0,"01/22/2026 14:32",https://www.instagram.com/p/DT1HGatk21a/,"Imagem do Instagram",,Total,640,396,23,2,0,0,0
18308971504255476,17841476283103388,setup.english,"SetUp - English School","Para você que tem vergonha de falar com sotaque, isso serve para te lembrar que a sua voz é parte da sua identidade e serve como um diferencial muito rico ao invés de uma limitação na fluência! 

Parabéns ao Wagner Moura pelo Golden Globe de Melhor Ator em Drama por The Secret Agent, fazendo assim história como o PRIMEIRO BRASILEIRO a conquistar esse prêmio e representando o Brasil neste Awards Season!",0,"01/16/2026 07:01",https://www.instagram.com/p/DTk2m7AjeLm/,"Carrossel do Instagram",,Total,1321,662,31,5,1,7,0
